{
  "schema_version": "1.0.0",
  "loop_id": "example-testing-loop-001",
  "current_step": "stegghost_ingestion_cge_admission",
  "next_step": "ephemeral_sandbox_batch",
  "dataset_manifest_hash": "sha256:0000000000000000000000000000000000000000000000000000000000000000",
  "prior_receipts": [
    {
      "step_id": "human_input",
      "receipt_id": "human-intake-receipt-001",
      "receipt_hash": "sha256:1111111111111111111111111111111111111111111111111111111111111111"
    },
    {
      "step_id": "sdk_or_llm_adapter_intake",
      "receipt_id": "sdk-intake-receipt-001",
      "receipt_hash": "sha256:2222222222222222222222222222222222222222222222222222222222222222"
    },
    {
      "step_id": "stegverse_org_ingestion_outbound",
      "receipt_id": "org-outbound-receipt-001",
      "receipt_hash": "sha256:3333333333333333333333333333333333333333333333333333333333333333"
    },
    {
      "step_id": "stegghost_ingestion_cge_admission",
      "receipt_id": "sandbox-cge-admission-receipt-001",
      "receipt_hash": "sha256:4444444444444444444444444444444444444444444444444444444444444444"
    }
  ],
  "master_records_receipts": [
    {
      "step_id": "human_input",
      "master_records_receipt_id": "mr-human-intake-001",
      "master_records_receipt_hash": "sha256:aaaaaaaaaaaaaaaaaaaaaaaaaaaaaaaaaaaaaaaaaaaaaaaaaaaaaaaaaaaaaaaa"
    },
    {
      "step_id": "sdk_or_llm_adapter_intake",
      "master_records_receipt_id": "mr-sdk-intake-001",
      "master_records_receipt_hash": "sha256:bbbbbbbbbbbbbbbbbbbbbbbbbbbbbbbbbbbbbbbbbbbbbbbbbbbbbbbbbbbbbbbb"
    },
    {
      "step_id": "stegverse_org_ingestion_outbound",
      "master_records_receipt_id": "mr-org-outbound-001",
      "master_records_receipt_hash": "sha256:cccccccccccccccccccccccccccccccccccccccccccccccccccccccccccccccc"
    },
    {
      "step_id": "stegghost_ingestion_cge_admission",
      "master_records_receipt_id": "mr-sandbox-cge-admission-001",
      "master_records_receipt_hash": "sha256:dddddddddddddddddddddddddddddddddddddddddddddddddddddddddddddddd"
    }
  ]
}
